{
  "created_at": "2026-09-06T04:27:23.981Z",
  "git_commit": "8f69a47",
  "population_fixation_prob": {
    "B1S1P1": 0.04617338722260745,
    "B1S1P2": 0.045082700734122766,
    "B1S2P1": 0.04815390495577057,
    "B1S2P2": 0.049110351190879566,
    "B1S3P1": 0.034825515051114544,
    "B1S4P1": 0.02800264455647777,
    "B1S4P2": 0.05494581284580946,
    "B1S5P1": 0.028862791492520357,
    "B2S1P1": 0.04762187908551671,
    "B2S1P2": 0.047870417877785135,
    "B2S2P1": 0.04918233522697163,
    "B2S2P2": 0.04293131321273166,
    "B2S3P1": 0.02775156131862255,
    "B2S4P1": 0.030586699740714787,
    "B2S4P2": 0.060086834343394506,
    "B2S5P1": 0.030017272396912938,
    "B3S1P1": 0.04792633588735276,
    "B3S1P2": 0.039083869955182156,
    "B3S2P1": 0.045295543325882814,
    "B3S2P2": 0.04637306691626698,
    "B3S3P1": 0.030725831751043188,
    "B3S4P1": 0.03619917546668811,
    "B3S4P2": 0.05021600312556955,
    "B3S5P1": 0.026399711757214825
  },
  "prediction_id": "abdd0611-110e-4502-a727-18ab19f2813a",
  "session_id": "da18f055-d99a-4308-af7a-6aafcd8c9178",
  "sha256": "829086c46bbf2d7f5828e13fffac944fdba177af73b1261fa53e544d918d666a",
  "sim_run_id": "a3a05676b782",
  "variant_id": "A"
}
